Location Name,Slug,Parent Region,SEO Description,Common Pests
Greater Noida Alpha 1,greater-noida-alpha-1,Greater Noida,"Pest control and termite treatment services in Greater Noida Alpha 1 for independent houses and apartments, preventing termite damage and protecting families from common household pests.","Termites, Cockroaches, Rodents, Ants, Bed Bugs, Mosquitoes, Flies, Spiders, Silverfish, Fleas, Wasps, Ticks, House Lizards, Bees, Mites"
Greater Noida Alpha 2,greater-noida-alpha-2,Greater Noida,"Comprehensive pest management in Greater Noida Alpha 2 with specialised termite control for wooden doors, wardrobes and furniture along with regular cockroach and rodent treatments.","Termites, Cockroaches, Rodents, Ants, Bed Bugs, Mosquitoes, Flies, Spiders, Silverfish, Fleas, Wasps, Ticks, House Lizards, Bees, Mites"
Greater Noida Alpha Commercial Belt,greater-noida-alpha-commercial-belt,Greater Noida,"Professional pest control services in Greater Noida Alpha Commercial Belt for shops, showrooms and offices, keeping kitchens, storage areas and basements hygienic and termite-free.","Termites, Cockroaches, Rodents, Ants, Bed Bugs, Mosquitoes, Flies, Spiders, Silverfish, Fleas, Wasps, Ticks, House Lizards, Bees, Mites"
Greater Noida Beta 1,greater-noida-beta-1,Greater Noida,"Reliable residential pest control and termite treatment in Greater Noida Beta 1 to safeguard builder floors and gated societies from hidden infestations and recurring insects.","Termites, Cockroaches, Rodents, Ants, Bed Bugs, Mosquitoes, Flies, Spiders, Silverfish, Fleas, Wasps, Ticks, House Lizards, Bees, Mites"
Greater Noida Beta 2,greater-noida-beta-2,Greater Noida,"End-to-end pest control solutions in Greater Noida Beta 2 for family homes, hostels and PGs, covering termites, cockroaches, bed bugs, rodents and mosquito breeding sites.","Termites, Cockroaches, Rodents, Ants, Bed Bugs, Mosquitoes, Flies, Spiders, Silverfish, Fleas, Wasps, Ticks, House Lizards, Bees, Mites"
Greater Noida Gamma 1,greater-noida-gamma-1,Greater Noida,"Expert pest and termite control in Greater Noida Gamma 1 with advanced soil treatment, wall drilling and gel-based applications for long-term pest prevention.","Termites, Cockroaches, Rodents, Ants, Bed Bugs, Mosquitoes, Flies, Spiders, Silverfish, Fleas, Wasps, Ticks, House Lizards, Bees, Mites"
Greater Noida Gamma 2,greater-noida-gamma-2,Greater Noida,"Holistic pest management services in Greater Noida Gamma 2 for apartments and villas, controlling termites, ants, spiders and flying insects across common areas and homes.","Termites, Cockroaches, Rodents, Ants, Bed Bugs, Mosquitoes, Flies, Spiders, Silverfish, Fleas, Wasps, Ticks, House Lizards, Bees, Mites"
Greater Noida Delta 1,greater-noida-delta-1,Greater Noida,"Professional pest control in Greater Noida Delta 1 for high-density residential blocks, with specialised termite control and rodent proofing for parking areas and basements.","Termites, Cockroaches, Rodents, Ants, Bed Bugs, Mosquitoes, Flies, Spiders, Silverfish, Fleas, Wasps, Ticks, House Lizards, Bees, Mites"
Greater Noida Delta 2,greater-noida-delta-2,Greater Noida,"Safe and effective pest control in Greater Noida Delta 2, targeting termites, cockroaches, bed bugs and mosquitoes in flats, balconies and garden-facing homes.","Termites, Cockroaches, Rodents, Ants, Bed Bugs, Mosquitoes, Flies, Spiders, Silverfish, Fleas, Wasps, Ticks, House Lizards, Bees, Mites"
Greater Noida Delta 3,greater-noida-delta-3,Greater Noida,"Residential pest and termite management in Greater Noida Delta 3 with odourless treatments suitable for families, children and pets while maintaining long-lasting protection.","Termites, Cockroaches, Rodents, Ants, Bed Bugs, Mosquitoes, Flies, Spiders, Silverfish, Fleas, Wasps, Ticks, House Lizards, Bees, Mites"
Greater Noida Delta 4,greater-noida-delta-4,Greater Noida,"Comprehensive pest control services in Greater Noida Delta 4 for large societies and parks, covering termites, rodents, ants and flying insects across landscaped areas and clubhouses.","Termites, Cockroaches, Rodents, Ants, Bed Bugs, Mosquitoes, Flies, Spiders, Silverfish, Fleas, Wasps, Ticks, House Lizards, Bees, Mites"
Greater Noida Zeta 1,greater-noida-zeta-1,Greater Noida,"Dedicated pest control and termite treatment in Greater Noida Zeta 1 for multi-tower complexes, focusing on basement, lift shaft and common utility area protection.","Termites, Cockroaches, Rodents, Ants, Bed Bugs, Mosquitoes, Flies, Spiders, Silverfish, Fleas, Wasps, Ticks, House Lizards, Bees, Mites"
Greater Noida Zeta 2,greater-noida-zeta-2,Greater Noida,"Tailored pest management services in Greater Noida Zeta 2 with regular termite inspections, cockroach gel treatments and rodent control in and around residential societies.","Termites, Cockroaches, Rodents, Ants, Bed Bugs, Mosquitoes, Flies, Spiders, Silverfish, Fleas, Wasps, Ticks, House Lizards, Bees, Mites"
Greater Noida Phi 1,greater-noida-phi-1,Greater Noida,"Premium pest and termite control services in Greater Noida Phi 1, protecting high-end apartments and villas from structural termite damage and daily pest nuisances.","Termites, Cockroaches, Rodents, Ants, Bed Bugs, Mosquitoes, Flies, Spiders, Silverfish, Fleas, Wasps, Ticks, House Lizards, Bees, Mites"
Greater Noida Phi 2,greater-noida-phi-2,Greater Noida,"Advanced termite and pest control in Greater Noida Phi 2 with focus on wooden flooring, wardrobes and modular kitchens along with mosquito and fly reduction programs.","Termites, Cockroaches, Rodents, Ants, Bed Bugs, Mosquitoes, Flies, Spiders, Silverfish, Fleas, Wasps, Ticks, House Lizards, Bees, Mites"
Greater Noida Chi 3,greater-noida-chi-3,Greater Noida,"Expert pest management in Greater Noida Chi 3 for mixed-use residential and commercial pockets, ensuring clean, safe spaces free from termites, rodents and cockroaches.","Termites, Cockroaches, Rodents, Ants, Bed Bugs, Mosquitoes, Flies, Spiders, Silverfish, Fleas, Wasps, Ticks, House Lizards, Bees, Mites"
Greater Noida Chi 4,greater-noida-chi-4,Greater Noida,"Full-spectrum pest control in Greater Noida Chi 4 with society-wide termite treatment, rodent control in parking and waste areas and mosquito control in open spaces.","Termites, Cockroaches, Rodents, Ants, Bed Bugs, Mosquitoes, Flies, Spiders, Silverfish, Fleas, Wasps, Ticks, House Lizards, Bees, Mites"
Greater Noida Eta 1,greater-noida-eta-1,Greater Noida,"Residential pest and termite solutions in Greater Noida Eta 1 for apartments and plotted houses, preventing damage from termites, silverfish and other crawling pests.","Termites, Cockroaches, Rodents, Ants, Bed Bugs, Mosquitoes, Flies, Spiders, Silverfish, Fleas, Wasps, Ticks, House Lizards, Bees, Mites"
Greater Noida Eta 2,greater-noida-eta-2,Greater Noida,"Comprehensive pest control services in Greater Noida Eta 2 across towers and community spaces, including termite barriers, bed bug treatments and rodent baiting programs.","Termites, Cockroaches, Rodents, Ants, Bed Bugs, Mosquitoes, Flies, Spiders, Silverfish, Fleas, Wasps, Ticks, House Lizards, Bees, Mites"
Greater Noida Pari Chowk,greater-noida-pari-chowk,Greater Noida,"Commercial hub pest control around Greater Noida Pari Chowk covering offices, cafes, showrooms and coaching centres with robust cockroach, rodent and termite management.","Termites, Cockroaches, Rodents, Ants, Bed Bugs, Mosquitoes, Flies, Spiders, Silverfish, Fleas, Wasps, Ticks, House Lizards, Bees, Mites"
Greater Noida Knowledge Park 1,greater-noida-knowledge-park-1,Greater Noida,"Specialised pest control services in Greater Noida Knowledge Park 1 for colleges, hostels and offices, protecting classrooms, canteens and labs from termites and common pests.","Termites, Cockroaches, Rodents, Ants, Bed Bugs, Mosquitoes, Flies, Spiders, Silverfish, Fleas, Wasps, Ticks, House Lizards, Bees, Mites"
Greater Noida Knowledge Park 2,greater-noida-knowledge-park-2,Greater Noida,"IT and institutional pest management in Greater Noida Knowledge Park 2 with discreet treatments for termites, rodents and insects in office blocks and educational campuses.","Termites, Cockroaches, Rodents, Ants, Bed Bugs, Mosquitoes, Flies, Spiders, Silverfish, Fleas, Wasps, Ticks, House Lizards, Bees, Mites"
Greater Noida Knowledge Park 3,greater-noida-knowledge-park-3,Greater Noida,"Comprehensive hostel and campus pest control in Greater Noida Knowledge Park 3 targeting bed bugs, cockroaches, termites and mosquitoes in hostels, cafeterias and common areas.","Termites, Cockroaches, Rodents, Ants, Bed Bugs, Mosquitoes, Flies, Spiders, Silverfish, Fleas, Wasps, Ticks, House Lizards, Bees, Mites"
Greater Noida Techzone 4,greater-noida-techzone-4,Greater Noida,"Corporate and residential pest control in Greater Noida Techzone 4 with strong termite control for structures and ongoing cockroach and rodent management for offices and flats.","Termites, Cockroaches, Rodents, Ants, Bed Bugs, Mosquitoes, Flies, Spiders, Silverfish, Fleas, Wasps, Ticks, House Lizards, Bees, Mites"
